animationScales,tutorialUrl,syntax,globals,output,toolbox,defines,textgoal,goal,board,fade,input
{},resources/videos/recursion.mp4,[],{},[],[u'countDown'],,This function uses recursion to count down to 0,[u'10'],"[u'15', u'function countDown(n) { return n == 10 ? n : countDown(n-1); }']",[{}],[]
{},,[],{},[],"[u'countDown', u'3', u'1', u'n']",,Define a function that counts down to 1,[u'1'],"[u'5', u'function countDown(n) { return n == _ ? n : countDown(_ - 1); }', u'n']",[{}],[]
{},,[],{},[],"[u'countUpTo', u'10', u'5', u'1', u'n']",,We can use recursion to count up too.,[u'5'],"[u'function countUpTo(x, n) { return x == _ ? x : countUpTo(x + 1, n); }']",[{}],[]
{},,[],{},[],"[u'__unlimited; countUpTo(_, 10)', u'x + 1', u'__unlimited; n']",,,"[u'10', u'10']","[u'function countUpTo(x, n) { return x == _ ? x : countUpTo(_, _); }', u'8', u'5']",[{}],[]
{},,[],{},"[u'5', u'10', u'8', u'6', u'2', u'0']",[u'__unlimited;countAboveFive'],[u'function countToFive(x) { return x == 5 ? x : countToFive(x + 1); }'],Define a function that outputs the difference between x and 5,"[u'_', u'_', u'_', u'_']","[u'function countAboveFive(num){ return num == 5 ? _ : countAboveFive(_)  + 1;}', u'0', u'_ - 1', u'num', u'__autograder(0)', u'__autograder(1)', u'__autograder(2)', u'__autograder(3)']",[{}],"[u'10', u'15', u'13', u'11', u'7', u'5']"
{},,[],{},"[u'10', u'2', u'6']","[u'maybe', u'__unlimited;countAboveTen', u'_ + 1', u'_ - 1', u'x', u'x', u'0']",[u'function howFarFromTen(x) { return x == 10 ? 0 : 1 + howFarFromTen(x + 1); }'],Define a function that outputs the difference between x and 10,"[u'_', u'_']","[u'function countAboveTen(x) { return _; }', u'__autograder(0)', u'__autograder(1)', u'_ == _', u'_ ? _ : _ ', u'10', u'countAboveTen']",[{}],"[u'20', u'12', u'16']"
{},,[],{},"[u'0', u'2', u'14', u'5']",[u'__unlimited;difference'],,Define a function that outputs the difference between two numbers,"[u'_', u'_', u'_']","[u'function difference(num, target){ return num == target ? 0 : difference(num - 1, target)  + 1;}', u'__autograder(1)', u'__autograder(0)', u'__autograder(2)']",[{}],"[u'(5, 5)', u'(57, 55)', u'(59, 45)', u'(239, 234)']"
{},,[],{},"[u'10', u'7', u'1']","[u'difference', u'_ + 1', u'_ - 1', u'__unlimited; x', u'__unlimited; y', u'0', u'!_']",[u'function howFarFromTen(x) { return x == 10 ? 0 : 1 + howFarFromTen(x + 1); }'],Define a function that outputs the difference between two numbers,[u'_'],"[u'function difference(x,y) { return _; }', u'_ == _ ? _ : _', u'__autograder(0)', u'difference']",[{}],"[u'(20, 10)', u'(12, 5)', u'(16, 15)']"
